Name,Prep Time,Cook Time,Total Time,Ingredients,Calories,Review Count,Average Rating,Category,URL
Curry Lime Chicken Phyllo Rolls,PT15M,PT30M,PT45M,"2 tablespoons olive oil', '1  small onion ((sliced))', '2  scallions ((chopped))', '3 cloves garlic ((minced))', '2 teaspoons curry powder', '2 cups cooked chicken ((shredded))', '1 tablespoon cilantro ((chopped))', '1  lime ((zested))', '2 tablespoons freshly squeezed lime juice', 'Salt', 'Pepper', '4 tablespoons butter ((melted))', '8  sheets phyllo dough', '¼ cup panko breadcrumbs ((or regular dried plain breadcrumbs))",430 kcal,1,5,Appetizer,https://thewoksoflife.com/curry-lime-chicken-phyllo-rolls/
Chicken and Thai Basil Stir-Fry,PT5M,PT10M,PT15M,"1  chicken breast', '1 tablespoon fish sauce', '1 tablespoon soy sauce', '1 teaspoon freshly squeezed lime juice', '1 teaspoon brown sugar', '1 teaspoon cornstarch', '1  small yellow squash ((sliced))', '1  medium carrot ((sliced))', '1  scallion ((sliced))', '1/2  of a small onion ((sliced))', '1 clove garlic ((chopped))', '1  red chili pepper ((chopped))', 'vegetable oil', '1/2 cup Thai basil",324 kcal,,,Chicken and Poultry,https://thewoksoflife.com/chicken-and-thai-basil-stir-fry/
Roasted Chicken with Sticky Rice,PT120M,PT45M,PT165M,"6  boneless chicken thighs ((skin on and fat trimmed))', '1  large shallot ((finely chopped))', '1 clove garlic ((minced))', '1 ½ tablespoons soy sauce (plus 1 teaspoon)', '1 tablespoon Shaoxing wine', '1 teaspoon five spice powder', '1 teaspoon sesame oil', 'Vegetable oil', '½ teaspoon salt and freshly ground white pepper ((or to taste))', '2 to 3 cups chicken stock', '2 cups sweet rice ((sticky rice))', '1  medium onion ((finely chopped))', '1  scallion ((finely chopped))', '8-10  dried shiitake mushrooms ((soaked in hot water for 1-2 hours))', '1-2  lean Chinese sausages ((lap cheung, optional))', 'salt and 1 more pinch of five spice powder",554 kcal,9,4.78,Chicken and Poultry,https://thewoksoflife.com/chicken-with-sticky-rice/
Steak Stir Fry (Chow Steak Kow),PT40M,PT20M,PT60M,"1 pound beef ribeye or sirloin steak ((cut into 1-inch cubes))', '1 1/2 tablespoons vegetable oil ((divided))', '1/8 teaspoon baking soda ((optional tenderizer, depending on the quality of your steak))', '1 teaspoon cornstarch', '1/4 teaspoon salt ((or to taste))', '5 tablespoons water', '1 teaspoon ketchup', '1 teaspoon Worcestershire sauce ((optional))', '2 teaspoons soy sauce', '2 teaspoons oyster sauce', '1/8 teaspoon ground white pepper', '1/8 teaspoon sesame oil', '1 tablespoon cornstarch ((mixed into a slurry with 1 tablespoon water))', '12 ounces fresh bok choy ((cut and thoroughly washed))', '1 tablespoon vegetable oil', '3-4 slices fresh ginger ((smashed))', '3 cloves garlic ((chopped))', '1/2 teaspoon salt', '1/8 teaspoon sugar', '1/8 teaspoon MSG ((optional))",344 kcal,3,5,Beef,https://thewoksoflife.com/steak-stir-fry/
Watercress Steamed Meatballs,PT60M,PT15M,PT75M,"1 pound beef chuck ((do not trim fat; hand-chop or ask the butcher to coarsely grind))', '1/2 cup cold water', '1/2 teaspoon baking soda', '1/2 teaspoon ginger ((grated or finely minced))', '1 teaspoon scallion whites ((finely minced))', '1 teaspoon sugar', '1 1/8 teaspoon salt', '1 tablespoon cornstarch', '1 tablespoon vegetable oil ((plus 1 teaspoon, divided))', '1/4 teaspoon sesame oil', '2 teaspoons Shaoxing wine', '1/4 teaspoon white pepper', '1 1/4 teaspoons dried tangerine peel ((coarsely ground in a mortar &amp; pestle))', '1/4 teaspoon coriander powder', '1  egg white', '2 bunches fresh watercress ((thoroughly washed and drained, divided))', '1/4 cup cilantro ((finely chopped))",172 kcal,2,5,Beef,https://thewoksoflife.com/watercress-steamed-meatballs/
Beef Chow Fun,PT60M,PT5M,PT65M,"8 oz. flank steak ((225g, sliced into 1/8 thick pieces))', '1/4 teaspoon baking soda ((optional))', '1 teaspoon cornstarch', '1 teaspoon soy sauce', '1 teaspoon vegetable oil', '12 oz. fresh wide rice noodles', '3 tablespoons vegetable oil', '4  scallions ((split in half vertically and cut into 3-inch pieces))', '3  thin slices ginger', '2 tablespoons Shaoxing wine', '1/2 teaspoon sesame oil', '2 teaspoons dark soy sauce', '2 tablespoons regular soy sauce', '1/8 teaspoon sugar', 'salt and white pepper ((to taste))', '4 to 6 ounces fresh mung bean sprouts",615 kcal,35,4.83,Noodles and Pasta,https://thewoksoflife.com/beef-chow-fun-noodles/
Hunan Beef,PT40M,PT20M,PT60M,"1 pound flank steak ((sliced 1/4-inch thick))', '1/4 teaspoon baking soda', '2 tablespoons water', '1 teaspoon oyster sauce', '1/3 cup cornstarch', '1  red Holland pepper ((25g, deseeded; can substitute red Fresno peppers))', '1  small green bell pepper or poblano pepper ((100g, deseeded))', '1  small red bell pepper ((100g, deseeded))', '2  banana peppers ((80g, deseeded))', '8  whole dried chili peppers', '1/2 teaspoon granulated sugar', '2 tablespoons hot water', '1/2 teaspoon Chinese black vinegar', '2 1/2 tablespoons soy sauce', '1/4 teaspoon white pepper', '1/3 cup vegetable or canola oil ((for frying))', '1 tablespoon fresh ginger ((8g, sliced))', '1/2 cup shallots ((thinly sliced, 40g))', '2 tablespoons Shaoxing wine', '5 cloves garlic ((15g, sliced))', '2 tablespoons fermented black beans ((20g, rinsed))', '2  scallions ((60g, cut at an angle into 2-inch lengths))",360 kcal,5,5,Beef,https://thewoksoflife.com/hunan-beef/
Pho Recipe,PT30M,PT330M,PT360M,"2  3-inch pieces ginger, cut in half lengthwise  ((no need to peel))', '2  onions ((peeled))', '5 pounds beef marrow or knuckle bones ((2.25 kg))', '2 pounds beef chuck ((900g, cut into 2 pieces))', '2  scallions ((cut into 4-inch lengths))', '1/3 cup fish sauce ((80 ml))', '2 ½ ounces rock sugar ((70g, or 2 1/2 tablespoons granulated sugar))', '8  star anise', '6  cloves', '1  cinnamon stick', '1  black cardamom pod ((optional))', '2 teaspoons fennel seeds', '2 teaspoons coriander seeds', '1 tablespoon salt', '1 pound dried pho noodles', '1/3 pound beef sirloin ((slightly frozen, then sliced paper-thin against the grain))', 'Sliced chili', 'Thinly sliced onion', 'Chopped scallions', 'Cilantro', 'Mung bean sprouts', 'Thai basil', 'Lime wedges",495 kcal,15,4.94,Noodles and Pasta,https://thewoksoflife.com/pho-vietnamese-noodle-soup/
How to Prepare Beef for Stir-fry,PT90M,,PT90M,"1 pound beef flank steak or chuck steak ((450g, sliced against the grain))', '1 teaspoon baking soda', 'water (3 tablespoons per pound)', '2 teaspoons vegetable oil', '2 teaspoons oyster sauce or soy sauce', '2 teaspoons cornstarch', '2 teaspoons Shaoxing Wine ((Optional))",,12,4.84,Beef,https://thewoksoflife.com/prepare-beef-for-stir-fry/
Mongolian Beef,PT75M,PT10M,PT85M,"8 ounces flank steak ((225g, sliced against the grain into 1/4-inch thick slices))', '1 teaspoon vegetable oil', '1 teaspoon low sodium soy sauce', '1 tablespoon cornstarch ((plus 1/4 cup, divided))', '1/3 cup vegetable oil ((for frying the beef))', '1/2 teaspoon ginger ((minced))', '5  dried red chili peppers ((optional))', '2 cloves garlic ((chopped))', '1/4 cup low sodium soy sauce', '1/4 cup water ((or low sodium chicken stock))', '2 tablespoons brown sugar', '1 tablespoon cornstarch ((mixed with 1 tablespoon water))', '2  scallions ((cut into 1-inch long slices on the diagonal))",375 kcal,110,4.87,Beef recipes,https://thewoksoflife.com/mongolian-beef-recipe/
Beef and Broccoli,PT35M,PT15M,PT50M,"1 pound flank steak  ((450g, sliced 1/4 inch thick))', '1/4 teaspoon baking soda ((optional))', '3 tablespoons water', '1 1/2 teaspoons cornstarch', '2 teaspoons vegetable oil', '1 teaspoon oyster sauce', '2/3 cup low sodium chicken stock ((warmed))', '1 1/2 teaspoons granulated sugar ((or brown sugar))', '1 1/2 tablespoons soy sauce', '1 teaspoon dark soy sauce ((or double black dark soy sauce))', '1 tablespoon oyster sauce', '1/2 teaspoon sesame oil', '1/8 teaspoon white pepper', '4 cups broccoli florets ((300g))', '3 tablespoons vegetable oil ((divided))', '2 cloves garlic ((minced))', '1/4 teaspoon ginger ((grated/minced, optional))', '1 tablespoon Shaoxing wine', '2 1/2 tablespoons cornstarch ((mixed with 3 tablespoons water))",232 kcal,37,4.82,Beef,https://thewoksoflife.com/beef-with-broccoli-all-purpose-stir-fry-sauce/
Hamburger Fried Rice,PT20M,PT15M,PT35M,"3/4 cup warm beef stock or water ((175 ml))', '2 tablespoons soy sauce ((30 ml))', '1 1/2 teaspoons mushroom flavored dark soy sauce ((8 ml))', '1 tablespoon oyster sauce', '1/4 teaspoon sesame oil', '1/4 teaspoon black pepper', '4 cups cooked white jasmine rice', '2 tablespoons vegetable oil, plus more for frying eggs ((30 ml))', '8 ounces ground beef ((225 g, we used 80% lean beef, but any ground beef will work))', '1  medium onion ((diced))', '1 clove garlic ((minced))', '1 tablespoon Shaoxing wine ((15 ml))', '1 cup frozen peas ((120 g))', '1  scallion ((chopped))', '4  eggs', '1 tablespoon soy sauce', '3 tablespoons hot water', '1 teaspoon sugar",536 kcal,,,Rice,https://thewoksoflife.com/hamburger-fried-rice/
Cantonese Instant Pot Braised Beef with Radish,PT15M,PT90M,PT105M,"3 to 3 ½ lbs beef rough flank ((1.5 kg, cut into 2 1/2-inch pieces))', '2 tablespoons vegetable oil ((30 ml))', '7 slices ginger', '1 cup Shaoxing wine ((240 ml))', '3 tablespoons light soy sauce ((45 ml))', '1 tablespoon dark soy sauce ((15 ml))', '1 tablespoon oyster sauce ((15 ml))', '3 pieces star anise', '5  cloves', '3  bay leaves', '1 tablespoon sugar ((12g))', '2 pounds daikon radish ((1 kg, peeled and cut into 1-½ inch pieces))', '¼ cup chicken stock or water ((mixed with 2 teaspoons cornstarch))', 'Salt ((to taste))', '2  scallions ((cut on a diagonal into 1-inch pieces))",374 kcal,12,4.92,Beef,https://thewoksoflife.com/instant-pot-braised-beef-radish/
Instant Pot Pho,,PT180M,PT180M,"2  3-inch pieces ginger, cut in half lengthwise', '2  medium onions ((peeled))', '4 pounds beef marrow and/or knuckle bones', '1 1/2 pounds beef chuck', '3  scallions ((cut into 4-inch lengths))', '⅓ cup fish sauce', '2 ounces rock sugar ((or 3 tablespoons granulated sugar))', '2 teaspoons salt', '3  star anise', '5  cloves', '1  small cinnamon stick', '1  black cardamom pod', '2 teaspoons fennel seeds', '2 teaspoons coriander seeds', '3 1/2 quarts water', 'Dried pho rice noodles', 'Thinly sliced onion', 'Mung bean sprouts', 'Thai basil', 'Lime wedges', 'Cooked beef balls ((thinly sliced eye round, optional))",644 kcal,11,4.91,Noodle Soup,https://thewoksoflife.com/instant-pot-pho/
Sukiyaki: A Japanese One Pot Meal,PT20M,PT20M,PT40M,"2 tablespoons sake', '¼ cup mirin', '1 tablespoon brown sugar', '¼ cup soy sauce', '½ block firm tofu ((sliced into ½ inch thick slices))', '5  dried shiitake mushrooms ((rehydrated))', '1 package  enoki mushrooms ((ends trimmed and rinsed))', '2 cups napa cabbage ((cut into 2-inch pieces))', '2 cups tong ho ((chrysanthemum greens, washed))', '2  scallions ((white and green parts separated))', '1 bundle dried mung bean vermicelli noodles ((or shirataki noodles))', '1 tablespoon vegetable oil', '12 oz. thinly sliced fatty beef', '2 cups dashi stock ((mushroom soaking liquid, or chicken stock))', '2 cups steamed rice', '2  egg yolks ((pasteurized, optional))",751 kcal,7,4.86,Beef,https://thewoksoflife.com/sukiyaki/
Beef and Mushroom Stir-Fry Rice Plate,PT20M,PT10M,PT30M,"12 ounces flank steak ((340g, sliced ¼-inch thick))', '1 tablespoon water', '1 teaspoon cornstarch', '1 teaspoon vegetable oil ((plus 3 tablespoons, divided))', '2 teaspoons oyster sauce', '¼ teaspoon baking soda ((optional))', '2½ cups beef stock ((warmed, no added vegetable in stock or water))', '2 tablespoons soy sauce', '1 teaspoon dark soy sauce', '2 tablespoons oyster sauce', '½ teaspoon sesame oil', '½ teaspoon salt ((or to taste))', '¼ teaspoon sugar', '1/8 teaspoon white pepper', '3 slices ginger', '2 cloves garlic ((sliced))', '2  scallions ((cut into 2-inch pieces at an angle, white and green portions separated))', '10 ounces mushrooms ((white button, cremini, or shiitake mushrooms, sliced))', '1½ tablespoons Shaoxing wine', '3 tablespoons cornstarch ((mixed with 3 tablespoons water))', '1 tablespoon butter ((optional))",219 kcal,15,4.94,Beef,https://thewoksoflife.com/beef-and-mushroom-stir-fry/
Shanghai-Style Red Vegetable Soup (罗宋汤 - Luo Song Tang),PT10M,PT120M,PT130M,"2 pounds oxtails', '2 tablespoons vegetable oil', '2  large onions', '6 cloves garlic', '3  small tomatoes ((about 12 ounces/340g, roughly chopped))', '2 tablespoons tomato paste', '10 cups water ((2.4L))', '2  large carrots ((about 12 ounces/340g, cut into large chunks))', '¼  cabbage ((about 12 ounces, roughly chopped))', '5  bay leaves', '2 teaspoons salt', '1 teaspoon black pepper', '1 pound potatoes ((450g, about 2 large potatoes, peeled and cut into large chunks))",383 kcal,8,5,Soup,https://thewoksoflife.com/red-vegetable-soup-shanghai-luo-song-tang/
Saucy Beef Chow Ho Fun Noodles,PT35M,PT10M,PT45M,"12 ounces flank steak ((340g, thinly sliced))', '¼ teaspoon baking soda ((optional))', '1 teaspoon soy sauce', '1 tablespoon water', '1 teaspoon vegetable oil', '½ teaspoon cornstarch', '1 pound fresh rice noodles ((wide/flat noodles))', '2 cups warm low sodium beef or chicken stock', '1 tablespoon light soy sauce', '2 teaspoons dark soy sauce', '2 tablespoons oyster sauce', '¼ teaspoon sugar', '¼ teaspoon sesame oil', 'white pepper ((to taste))', '3 tablespoons canola oil ((divided))', '3  thin slices ginger', '3 cloves garlic ((minced))', '½ cup fresh shiitake mushrooms ((1½ ounces, 45g))', '2  scallions ((cut at an angle into 2-inch pieces, with the white and green parts separated))', '1 tablespoon Shaoxing wine', '2 cups napa cabbage ((about 6 ounces/170g, cut crosswise into ½-inch pieces))', '2 cups fresh mung bean sprouts ((5 ounces/140g))', '2 tablespoons cornstarch ((mixed with 2 tablespoons water))",436 kcal,7,4.86,Noodles,https://thewoksoflife.com/chow-ho-fun-noodles-saucy-beef/
Instant Pot Braised Curry Beef,PT15M,PT60M,PT60M,"3 1/2 pounds beef outside flank/rough flank ((牛腩, can also substitute beef brisket or chuck, cut into large 2-inch cubes))', '¼ cup vegetable oil ((plus 1 tablespoon, divided))', '5 cloves garlic ((chopped))', '5  shallots ((finely chopped))', '3  bay leaves', '⅓ cup curry powder', '1 teaspoon turmeric powder', '2 cups beef broth ((chicken broth or water))', '4 teaspoons sugar', '1 tablespoon salt ((plus more to taste))', '2 tablespoons tomato paste', '2  large onions ((cut into wedges))', '2 teaspoons cornstarch ((dissolved in 1 tablespoon water))",440 kcal,18,5,Beef,https://thewoksoflife.com/braised-curry-beef-instant-pot/
Steak Bites with Miso Ginger Dressing,PT30M,PT5M,PT35M,"1  shallot ((peeled and roughly chopped))', '3 tablespoons fresh ginger ((roughly chopped))', '1 clove garlic', '¼ cup white miso paste', '2 tablespoons rice wine vinegar', '½ teaspoon sesame oil', '⅓ cup oil', '2 tablespoons honey or agave', 'Cooked rice ((or other grain of choice--quinoa, couscous, or farro would all work great))', 'A couple handfuls of bok choy or any leafy vegetable of choice ((you can do this cooked or raw!))', '1 pound steak ((ribeye, sirloin, and skirt steak all work well))', '2 tablespoons butter or oil', '1 teaspoon dark soy sauce', 'Salt to taste",781 kcal,9,5,Beef,https://thewoksoflife.com/steak-bites-miso-ginger/
Dry Fried Sichuan Beef,PT20M,PT5M,PT25M,"3 tablespoons oil', '12 ounces flank steak ((340g, cut into ⅓ inch thick strips))', '5 slices ginger ((julienned))', '1 tablespoon spicy bean sauce', '2  stalks celery ((julienned))', '1  small carrot ((julienned))', '1 tablespoon Shaoxing wine', '¾ teaspoon sugar', '1 tablespoon light soy sauce', '1 teaspoon sesame oil', '1 teaspoon ground Sichuan peppercorn', '1/8 teaspoon chili flakes ((optional))', '2  scallions ((julienned))",250 kcal,16,4.75,Beef,https://thewoksoflife.com/sichuan-beef-dry-fried/
Sha Cha Beef Stir-fry,PT10M,PT6M,PT16M,"1 pound beef ((450g, thinly sliced against the grain; can use flank steak or sirloin))', '1 teaspoon soy sauce ((plus 1 tablespoon))', '2 teaspoons cornstarch', 'Vegetable oil', '1-2 tablespoons ginger ((minced))', '3 cloves garlic ((thinly sliced))', '2 tablespoons Sha cha Sauce', '2 teaspoon sugar', '5  scallions ((cut on an angle into 2-inch lengths))",349 kcal,3,5,Beef,https://thewoksoflife.com/sha-cha-beef-stir-fry/
Taiwanese Beef Noodle Soup: In an Instant Pot or On the Stove,PT30M,PT120M,PT150M,"3 pounds beef shank ((1.4 kg, cut into 2-inch chunks))', '2 tablespoons oil', 'A 2-inch piece of ginger ((smashed))', '6 cloves garlic ((smashed))', '3  scallions ((cut into 2-inch segments))', '1  onion ((cut into wedges))', '1  tomato ((cut into wedges))', '4  dried chilies ((ripped in half))', '1 tablespoon tomato paste', '2 tablespoons spicy bean paste (douban jiang)', '2 teaspoons sugar', '1/2 cup soy sauce', '1/2 cup Shaoxing wine', '1  Chinese aromatic herb packet ((lu bao––do yourself a favor and hunt down the pre-packaged version; if you can’t access it though, see below for ingredients to create your own spice sachet))', '32 ounces fresh wheat (white) noodles ((900g))', 'A small handful of bok choy for each serving', 'Cilantro ((finely chopped))', 'Scallions ((finely chopped))', 'Pickled mustard greens ((to taste))', '4  star anise', '1  Chinese cinnamon stick', '3  bay leaves', '1 tablespoon fennel seeds', '1 tablespoon cumin seeds', '1 teaspoon coriander seeds', '2 tablespoons Sichuan peppercorns', '¼ teaspoon five spice powder', '¼ teaspoon black pepper",435 kcal,63,4.81,Noodles,https://thewoksoflife.com/taiwanese-beef-noodle-soup-instant-pot/
Beef Vegetable Stir-Fry,PT30M,PT10M,PT40M,"12 ounces flank steak ((sliced ⅛-inch thick into 2- to 3-inch pieces))', '1 teaspoon water', '¼ teaspoon baking soda', '1 teaspoon cornstarch', '2 teaspoons vegetable oil', '4 cups bok choy ((250g, cut into 1x3-inch pieces, washed and drained))', '¾ cup Bunashimeji or Beech mushrooms, washed and drained ((50g))', '¾ cup sugar snap peas or snow peas ((65g, washed and drained))', '½ cup warm water or beef stock', '¼ teaspoon sesame oil', '2 teaspoons soy sauce', '1 teaspoon dark soy sauce ((or mushroom flavored dark soy sauce if you have it))', '1 tablespoon oyster sauce', '¼ teaspoon sugar', '3 tablespoons canola oil ((divided))', '½ teaspoon minced ginger', '2 cloves garlic ((finely minced))', '1 tablespoon Shaoxing wine', '2 teaspoons cornstarch ((mixed with 1 tablespoon water))",377 kcal,4,4.5,Beef,https://thewoksoflife.com/beef-vegetable-stir-fry/
Chinese Beef Stir-Fry with YouTiao (Chinese Fried Dough),PT20M,PT10M,PT30M,"12 ounces flank steak ((340g, sliced into 2-inch long pieces))', '1 teaspoon cornstarch', '1/8 teaspoon baking soda', '2 teaspoons vegetable oil ((plus 2 tablespoons))', '2 pieces Chinese fried dough ((you tiao))', '2 tablespoons light brown sugar ((or granulated sugar))', '1 tablespoon minced shallot or red onion', '½ cup beef stock ((or chicken stock))', '1 teaspoon dark soy sauce', '1 tablespoon soy sauce', '¼ teaspoon Zhenjiang black vinegar', '2 teaspoons cornstarch ((mixed with 1 tablespoon water))', '1 teaspoon toasted sesame seeds', '1 tablespoon scallion ((chopped))",274 kcal,6,5,Beef,https://thewoksoflife.com/chinese-beef-stir-fry-youtiao/
Asian Pot Roast: A New Take on a Classic Sunday Dinner,PT15M,PT165M,PT180M,"4 pounds boneless beef chuck roast ((1.8 kg))', '2 tablespoons vegetable or canola oil', '3 slices ginger ((mashed))', '2  medium onions ((thinly sliced))', '5 cloves garlic ((peeled and smashed))', '2 cups beef stock', '1/3 cup shaoxing wine or dry sherry', '3 tablespoons soy sauce', '1 tablespoon dark soy sauce', '2 teaspoons sugar', '5  medium carrots', '3  scallions ((cut into 2-inch lengths))', '1 1/2 tablespoons cornstarch ((dissolved into ¼ cup water))",337 kcal,5,5,Beef,https://thewoksoflife.com/asian-pot-roast/
Bo Kho: Spicy Vietnamese Beef Stew with Noodles,PT40M,PT140M,PT180M,"2 to 2 ½ pounds boneless beef chuck or brisket ((cut into 1½-inch chunks))', '2 cloves garlic ((minced))', '3 tablespoons ginger ((minced))', '5 tablespoons fish sauce', '2½ teaspoons five-spice powder', '1½ teaspoons brown sugar', '3 tablespoons oil', '1 stalk lemongrass ((cut into 3-inch lengths, after removing any tough woody parts))', '2 stalks lemongrass ((minced, after removing any tough woody parts))', '8 cloves garlic ((minced))', '1  onion ((sliced thinly))', '4 tablespoons tomato paste', '8 cups water', '2 cups pure coconut water/juice', '2  star anise', '1 teaspoon ground black pepper', '1 teaspoon chili powder', '1 teaspoon ground annatto ((optional))', '1 tablespoon paprika', '8  large carrots ((peeled and cut on the bias into 1½ -inch chunks))', '1 teaspoon salt', '3 tablespoons soy sauce', '3 tablespoons chili oil ((or to taste))', 'wide rice noodles\xa0or\xa0egg noodles', '¼ cup coarsely chopped fresh cilantro leaves', '1/2 cup Thai basil leaves', '1/2 cup Thinly sliced raw onion', 'Lime wedges",615 kcal,41,4.88,Beef,https://thewoksoflife.com/bo-kho-spicy-vietnamese-beef-stew/
Campfire Beef Stew,PT15M,PT120M,PT135M,"2 pounds beef chuck ((900 g, cut into large chunks))', 'salt and pepper', '1/4 cup flour ((plus more for thickening the stew, if needed))', '2 tablespoons butter ((28g))', '2 tablespoons olive oil', '3 cloves garlic ((sliced))', '1  large onion ((chopped))', '15 ounces diced canned tomatoes ((425g))', '12  small to medium carrots ((cut into large chunks))', '1 teaspoon dried thyme ((or 2 sprigs fresh thyme))', '1 teaspoon dried rosemary ((or one sprig of fresh rosemary))', '1 1/2 cups dry red wine ((355 ml))', '2 cups water or beef stock ((475 ml))', '12 ounces egg noodles', 'salt', '4 tablespoons butter ((57g))', '1/2 cup parsley ((chopped))",581 kcal,4,4.75,Beef,https://thewoksoflife.com/campfire-beef-stew-buttered-parsley-noodles/
Beef and Egg Stir Fry Rice Bowls,PT25M,PT5M,PT30M,"8 ounces flank steak ((225g, thinly sliced))', '1 teaspoon oil', '1 teaspoon light soy sauce', '1 teaspoon cornstarch', '1/8 teaspoon baking soda', '1 tablespoon oil', '2 cloves garlic ((minced))', '2  scallions ((chopped))', '1 tablespoon Shaoxing wine', '2½ cups chicken stock or beef stock', '¼ teaspoon salt', '¼ teaspoon sugar', '1 tablespoon light soy sauce', '2 teaspoons dark soy sauce', '1 tablespoon oyster sauce', '½ teaspoon sesame oil', 'Freshly ground white pepper', '2 tablespoons cornstarch ((mixed with 2 tablespoons water))', '2  eggs (lightly beaten)",485 kcal,11,4.73,Beef,https://thewoksoflife.com/beef-egg-stir-fry-rice/
Easy Beef Korean Bibimbap Recipe,PT15M,PT30M,PT45M,"2 1/2 cups medium grain white rice', '1 1/2 cups mung bean sprouts', '1 bunch watercress or spinach', '1  large carrot', '2 cloves garlic', 'Salt', '2 teaspoons sesame oil ((divided))', '1 tablespoon vegetable oil', '1 pound ground beef', '1 tablespoon soy sauce ((dark soy sauce, if you have it))', '4  eggs', '½ cup napa cabbage kimchi', '2 tablespoons gochujang ((Korean red pepper paste))', '2 teaspoons toasted sesame seeds",861 kcal,6,4.67,Rice,https://thewoksoflife.com/easy-beef-bibimbap-recipe/
Chinese Spiced Braised Beef Shank,PT10M,PT120M,PT130M,"2  cinnamon sticks', '1  black cardamom pod', '½ tablespoon Sichuan peppercorns', '2  star anise', '8  cloves', '1 piece dried tangerine peel', '2  bay leaves', '1 teaspoon white or black peppercorns', '3  dried liquorice slices ((甘草 - optional))', '1  whole nutmeg ((optional))', '1 tablespoon fennel seeds ((optional))', '2½ pounds beef shank ((1.1 kg))', '3 slices ginger', '¼ cup Shaoxing wine', '5 cloves garlic', '4  scallions ((cut into large pieces))', '15 grams rock sugar ((can substitute with regular granulated sugar))', '¼ cup light soy sauce', '2 tablespoons dark soy sauce', 'About 4 cups water ((or optionally, chicken, beef, or pork stock, enough to cover the beef))', 'Salt ((to taste, we used about 1 teaspoon))",200 kcal,7,5,Beef,https://thewoksoflife.com/braised-beef-shank/
Braised Beef Noodle Soup (红烧牛肉面),PT30M,PT120M,PT150M,"2  small pieces Chinese (cassia) cinnamon ((5 grams))', '2  black cardamom pods (草果) ((5 grams))', '½ tablespoon fennel seeds', '4  star anise pods', '10  cloves', '1  dried tangerine peel', '6  bay leaves', '½ tablespoon whole white peppercorns', '4 slices licorice root (甘草片) ((甘草, gan-cao, 7 grams))', '2 pieces sand ginger (山奈／沙姜) ((山奈／沙姜, shan-nai / sha-jiang, 6 grams))', '10 pieces dried amomum white cardamom (白寇) ((白寇, bai-kou, 3 grams))', '3 pounds beef chuck ((680g, cut into large chunks))', '16 cups water', '5 slices ginger', '3 tablespoons oil', '15 grams rock sugar', '5  scallions ((with the white and green parts separated))', '1  whole head of garlic ((cloves peeled but kept whole))', '1 pound daikon ((cut into ¼-inch thick slices, with each slice quartered))', '¼ cup Shaoxing wine', '1 tablespoon dark soy sauce', '¼ cup light soy sauce', 'Salt ((to taste))', 'Noodle of your choice', 'Leafy greens of your choice ((spinach, romaine lettuce, choy sum, and bok choy are all good))', 'Handful of chopped cilantro ((optional))",519 kcal,12,4.75,Noodles and Pasta,https://thewoksoflife.com/braised-beef-noodle-soup/
Beef Bulgogi Tacos - Korean Mexican Fusion,PT150M,PT10M,PT160M,"1  small Asian pear', '½  of a small onion', '4 cloves garlic', '1 inch piece ginger', '2½ tablespoons soy sauce', '2 tablespoons brown sugar', '1/8 teaspoon ground black pepper', '1 tablespoon sesame oil', '1 1/2 pounds any tender cut of beef ((like top sirloin, thinly sliced against the grain))', 'Vegetable oil', 'Corn Tortillas', '1 cup cabbage ((shredded))', 'Kimchi', 'Cilantro', 'Sour cream', 'Queso fresco', 'Lime Juice",437 kcal,3,5,Beef,https://thewoksoflife.com/bulgogi-tacos/
