Name,Prep Time,Cook Time,Total Time,Ingredients,Calories,Review Count,Average Rating,Category,URL
Tofu with Black Bean Sauce - 豉汁豆腐,PT20M,PT20M,PT40M,"1 pound firm tofu ((450g))', '3 tablespoons oil ((divided))', '2 cloves garlic ((minced))', '2 tablespoons fermented black beans ((rinsed))', '2  scallions ((cut into large pieces, whites and greens separated))', '3  dried or fresh red chilies ((deseeded and chopped, optional))', '1 tablespoon Shaoxing wine', '½ tablespoon light soy sauce', '½ teaspoon sesame oil', '¼ teaspoon ground white pepper', '¼ teaspoon sugar', '1 teaspoon cornstarch ((dissolved in 2 tablespoons water))",237 kcal,9,5,Tofu,https://thewoksoflife.com/tofu-black-bean-sauce/
Soondubu Jigae (Korean Soft Tofu Stew),PT20M,PT50M,PT70M,"10  large dried anchovies ((heads and belly removed, this is easier than it sounds))', '⅓  of a small daikon radish\xa0 ((5 ounces, peeled, washed, and sliced thinly))', '1 piece dried kelp ((6x4 inches))', '3  dried shiitake mushrooms', '5 cups water', '1 tablespoon vegetable oil ((divided))', '2 cloves minced garlic', '1  small onion ((thinly sliced))', '1 cup pork belly ((or any other cut of pork, about 2-3 ounces per serving, cut into small pieces))', '1 cup kimchi ((roughly chopped, most of the jarred kinds are already cut))', '2 teaspoons salt', '1 teaspoon sugar', '4 tablespoons Korean chili flakes', '2 teaspoons sesame oil', '1 package (silken tofu) ((if you can find it, use a Korean brand, as it’s a denser, richer tofu!))', '2  eggs', '1  scallion ((diced into small rounds))",468 kcal,2,5,Tofu,https://thewoksoflife.com/soondubu-jigae-korean-tofu-stew/
Vegetable Moo Shu,PT30M,PT10M,PT40M,"1 tablespoon light soy sauce', '½ teaspoon sesame oil', '1 tablespoon hoisin sauce ((plus extra for serving))', '¼ teaspoon ground white pepper', '¼ teaspoon salt', '3 ½ tablespoons oil ((divided))', '2  carrots ((julienned, about 1½ cups))', '2 pieces spiced tofu ((4 ounces/113g, julienned))', '1½ cups celery ((julienned))', '1  red bell pepper ((thinly sliced))', '6  fresh Shiitake mushrooms ((thinly sliced))', '2 cloves garlic ((minced))', '1  leek ((julienned, about 3 cups))', '1 tablespoon Shaoxing wine', 'Mandarin pancakes ((recipe can be found\xa0here))",136 kcal,5,4.8,Vegetables,https://thewoksoflife.com/vegetable-moo-shu/
Chinese Tofu Salad,PT20M,,PT20M,"1 cup red bell pepper ((julienned))', '1 cup red onion ((thinly sliced))', '1 cup carrot ((julienned))', '1 cup cucumber ((julienned))', '1 cup celery ((julienned))', '8 ounces shredded spiced tofu ((tofu &quot;noodles&quot;))', '1 tablespoon light olive oil', '1 teaspoon garlic ((minced))', '1½ teaspoons sugar', '¼ teaspoon ground white pepper', '2 tablespoons light soy sauce', '1 tablespoon Chinese black vinegar', '1 teaspoon sesame oil', '1 tablespoon toasted sesame seeds', '1/4 cup cilantro ((chopped))",145 kcal,8,5,Tofu,https://thewoksoflife.com/chinese-tofu-salad/
Cheat’s Mapo Tofu,PT5M,PT10M,PT15M,"6 ounces ground pork', '1 tablespoon ginger ((minced))', '5 cloves garlic', '7 oz. mapo tofu sauce packet ((200g, we used Spicy Element’s Shengchubao Mapo Tofu Sauce))', '1 cup water', '2 teaspoons cornstarch ((mixed with 1 tablespoon water))', '24 ounces silken tofu ((you can also use soft or firm tofu if you prefer))', '1  scallion ((chopped))', '1/2 teaspoon Sichuan Peppercorn Powder ((optional))",,4,4.5,Tofu,https://thewoksoflife.com/cheats-mapo-tofu-packet/
Stir Fried Bok Choy with Tofu Skin (腐皮青菜),PT30M,PT5M,PT35M,"3 tablespoons oil', '1 teaspoon ginger ((minced))', '5 cloves garlic ((chopped))', '¾ pound bok choy ((thoroughly washed and drained))', '1 teaspoon salt ((or to taste))', '½ teaspoon sugar', '2 teaspoons sesame oil', '¼ teaspoon ground white pepper', '2 tablespoons water', '½  pack of fresh tofu skin ((cut into bite-sized pieces, about 2 cups))', '1 teaspoon cornstarch ((dissolved in 2 tablespoons water))",228 kcal,5,4.41,Vegetables,https://thewoksoflife.com/bok-choy-tofu-skin/
Superfood Miso Soup,PT60M,PT35M,PT95M,"2  6-inch square pieces of kombu', '6  dried shiitake mushrooms', '12 cups water ((2.8 L))', '1 cup bonito flakes ((Katsuobushi))', '12 ounces soft tofu ((340g))', '5 tablespoons white miso paste', '2 cups baby spinach', '2  scallions ((chopped))",151 kcal,4,5,Soups and Stocks,https://thewoksoflife.com/superfood-miso-soup/
How to Make Soy Milk at Home,PT720M,PT20M,PT740M,"10 ounces soybeans ((285g, soaked overnight))', '12 cups water', '1/8 teaspoon salt', 'Sugar ((to taste, optional))",133 kcal,3,4.34,Soups and Stocks,https://thewoksoflife.com/how-to-make-soy-milk/
General Tso's Tofu,PT15M,PT15M,PT30M,"1½ tablespoons honey', '2 teaspoons Louisiana hot sauce ((such as Crystal))', '1 pound regular or firm tofu ((450g; drained, pat dry, and cut into 1-inch squares))', '1 ½ tablespoons sesame seeds', '2 to 3 tablespoons cornstarch ((depending on how wet the tofu is))', '⅓ cup peanut or canola oil ((for shallow frying))', '½ teaspoon ginger ((minced))', '2 cloves garlic ((minced))', '7  whole dried Chinese red chili peppers ((optional))', '½  red bell pepper ((cut into large pieces))', '½ tablespoon Shaoxing wine', '1 cup water or vegetable stock', '2 cups broccoli florets', '1½ tablespoons light soy sauce', '1 teaspoon dark soy sauce', '2 teaspoons rice vinegar', '¼ teaspoon salt', '1 tablespoon sugar', '½ teaspoon sesame oil', '1½ tablespoons cornstarch ((mixed with 1 tablespoon water))",400 kcal,9,5,Tofu,https://thewoksoflife.com/general-tsos-tofu/
Shanghai Hot Sauce Noodles (Lajiang Mian -上海辣酱面）,PT10M,PT40M,PT50M,"8 ounces pork shoulder ((225g, cut into ¼ inch cubes))', '1/2 cup raw shelled and skinned peanuts', '1/4 cup peanut or vegetable oil', '¼ cup doubanjiang ((spicy chili bean sauce/paste))', '¼ cup onion ((diced))', '2  medium carrots ((cut into ¼ inch cubes, about ¾ cup))', '4 ounces five spice tofu ((cut into ¼ inch cubes, 3/4 cup))', '2 teaspoons sugar', '6 cups chicken stock ((divided))', '12 ounces dried noodles ((340g))', '1  scallion ((chopped, optional))",699 kcal,10,4.8,Noodles ad Pasta,https://thewoksoflife.com/shanghai-hot-sauce-noodles/
"Hunan Pork and Tofu Spicy Stir Fry, by thewoksoflife.com",PT20M,PT10M,PT30M,"10 ounces pork ((280g, sliced ⅛-inch thick))', '2 tablespoons water', '1 teaspoon oil', '1 teaspoon cornstarch', '6 tablespoons vegetable or canola oil ((divided))', '1 pound firm tofu ((450g, drained and cut into 2-inch squares, ½-inch thick))', '1 teaspoon ginger ((minced))', '2 tablespoons spicy bean sauce ((doubanjiang))', '3  scallions ((cut on an angle into 2-inch pieces))', '2 teaspoons fresh garlic ((minced))', '3 tablespoons fermented black beans', '1  red bell pepper ((cut into 1x2-inch pieces, about 1½ cups))', '1 tablespoon Shaoxing wine', '¾ teaspoon sugar', '⅓ cup hot water or chicken stock', '1 teaspoon cornstarch ((mixed with 1 tablespoon water))",355 kcal,6,5,Pork,https://thewoksoflife.com/hunan-pork-tofu/
"Ma Lan Tou Spiced Tofu, A Shanghai Favorite",PT10M,PT5M,PT15M,"12 ounces ma lan tou\xa0(马兰头) ((340g))', '4 ounces dried spiced tofu ((115g, dòufu gān - 豆腐干))', '3/4 teaspoon salt', '1/2 teaspoon sugar', '1 tablespoon sesame oil",45 kcal,2,5,Tofu,https://thewoksoflife.com/ma-lan-tou-spiced-tofu/
10-Minute Broccoli Tofu Bowls,PT5M,PT5M,PT10M,"16 oz. firm tofu ((450g))', '1 cup chicken or vegetable stock ((235 ml))', '2 tablespoons soy sauce', '1 teaspoon dark soy sauce', '2 tablespoons Shaoxing wine ((or dry sherry cooking wine))', '1 teaspoon sesame oil', '½ teaspoon sugar', '2 tablespoons vegetable oil', '2 cloves garlic ((chopped))', '1 pound broccoli ((450g, cut into small florets))', '1 tablespoon cornstarch ((dissolved in 2 tablespoons water))",241 kcal,8,4.38,Tofu,https://thewoksoflife.com/broccoli-tofu-bowls/
Beef Tofu Stir-Fry,PT25M,PT5M,PT30M,"10 ounces flank steak ((285g, sliced ¼-inch thick))', '1 tablespoon water', '1 teaspoon vegetable oil', '½ teaspoon cornstarch', '¼ teaspoon baking soda', '½ teaspoon soy sauce', '2 tablespoons vegetable or canola oil', '3  thin slices ginger', '2 cloves garlic ((minced))', '2  scallions ((cut at an angle into 1-inch pieces, white and green portions separated))', '2 teaspoons Shaoxing wine', '¾ cup beef or chicken stock', '2 tablespoons oyster sauce', '1 teaspoon soy sauce', '½ teaspoon sesame oil', '¼ teaspoon ground white pepper', '¼ teaspoon sugar', '1 pound regular or soft tofu ((450g, cut into 2-inch squares, 1/2-inch thick))', '1 tablespoon cornstarch ((mixed with 1 tablespoon of water))",300 kcal,11,5,Tofu,https://thewoksoflife.com/beef-tofu-stir-fry/
Kimchi Stew (Kimchi Jigae Recipe),PT10M,PT30M,PT40M,"1 tablespoon oil', '1  onion ((thinly sliced))', '3 cloves garlic ((sliced))', '8 ounces pork belly or shoulder ((225g, thinly sliced))', '1 pound kimchi ((450g, with juices, chopped))', '1 teaspoon salt', '2 teaspoons sugar', '1 tablespoon Korean chili flakes', '1 tablespoon gochujang ((Korean red pepper paste))', '3 cups chicken stock ((700 ml, can substitute fish or beef stock))', '8 oz. firm tofu ((225g, cut into 1/4-inch thick slices))', '1 teaspoon sesame oil', '1  scallion ((chopped))",295 kcal,8,5,Soups and Stocks,https://thewoksoflife.com/kimchi-stew/
Home-Style Tofu Stir-fry,PT15M,PT15M,PT30M,"2 tablespoons oil (divided)', '1 pound firm tofu ((450g, pat dry, cut in half lengthwise and sliced into 1/4&quot; slices))', '2 cloves garlic ((smashed and chopped))', '1  red chili pepper ((deseeded and thinly sliced))', '3  scallions ((cut into 1” pieces, with the white parts separated from the green parts))', '4 oz. ground pork ((110g; can substitute ground chicken))', '2 tablespoons light soy sauce', '2 teaspoons oyster sauce ((or vegetarian oyster sauce))', '1 teaspoon Shaoxing wine ((can substitute other rice wine or dry cooking sherry))', '1/4 teaspoon sugar', '1/4 cup water', 'Salt ((to taste))",251 kcal,6,4.84,Tofu,https://thewoksoflife.com/home-style-tofu-stir-fry/
“Crispy Skin” Stuffed Tofu,PT30M,PT15M,PT45M,"6 ounces shrimp ((170g, peeled and deveined))', '1¼ teaspoons salt', '1 teaspoon oil', '½ teaspoon sesame oil', '½ teaspoon Shaoxing wine', '1½ teaspoon cornstarch', 'Fresh ground white pepper', '1 pound soft tofu ((450g))', '2 tablespoons cornstarch', '4 cups oil ((for frying))', '1 teaspoon sugar', '1 tablespoon light soy sauce', '¼ teaspoon dark soy sauce', '1 tablespoon chopped scallions",268 kcal,2,5,Tofu,https://thewoksoflife.com/crispy-skin-stuffed-tofu/
Ma La Xiang Guo (Spicy Numbing Stir-fry Pot),PT180M,PT30M,PT210M,"3  celery stalks ((thinly sliced))', '2  carrots ((thinly sliced))', '2  potatoes ((sliced))', '2 cups rehydrated wood-ear mushrooms ((rinsed and drained))', '3  long pieces of rehydrated tofu bean threads ((Fǔzhú, drained))', '4-6  shiitake ((rehydrated if using dried shiitake mushrooms, washed and sliced))', 'a handful of sliced lotus root', '1/3 cup oil ((80 ml))', '3  star anise', '2 tablespoons Sichuan peppercorn', '1 tablespoon fennel seeds', '1  black cardamom', '1  cinnamon stick', '3  bay leaves', '1  whole nutmeg', '1  large dried orange peel', '2 pieces dried ginger ((or 5 slices of fresh ginger))', '1/4 cup dried red chili peppers ((keep them whole to avoid the dish being too hot))', '2 tablespoons spicy red bean sauce', '2 tablespoons hot pot soup base sauce', '6 slices ginger', '8 cloves garlic ((smashed))', '3  shallots ((sliced))', '1 cup dried red chili peppers ((keep them whole to avoid the dish being too hot))', '3  scallions ((chopped))', '1/4  head cabbage ((sliced))', '7 oz. pack fish balls ((200g, optional))', '2 tablespoons Shaoxing wine', '1 tablespoon sugar', 'Salt to taste', 'a handful of chopped cilantro",361 kcal,11,4.91,Vegetables,https://thewoksoflife.com/ma-la-xiang-guo/
Spicy Griddled Tofu “Steaks”,PT10M,PT10M,PT20M,"1 pound firm tofu', '1 teaspoon cumin seeds', '¼ teaspoon ground Sichuan peppercorn powder ((optional))', '1 teaspoon red chili pepper powder', '¼ teaspoon garlic powder', '¼ teaspoon salt', '2 tablespoons oil ((plus 1 teaspoon))', '1 tablespoon hoisin sauce', '1 teaspoon soy sauce', '1 tablespoon cilantro ((chopped))', '1 tablespoon scallion ((chopped))",162 kcal,6,5,Tofu,https://thewoksoflife.com/spicy-griddled-tofu-steaks/
Hunan Steamed Fish with Salted Chilies (Duo Jiao Yu),PT10M,PT15M,PT25M,"12 oz. tilapia or flounder filet ((340g))', '12 oz. firm tofu ((340g))', '2 tablespoons soy sauce', '1/4 - 1/3 cup jarred hunan chili peppers ((try finding the &quot;Tantan Xiang&quot; brand at your Chinese grocery store))', '1/2 teaspoon sugar', '1 tablespoon fermented black beans ((whole black beans, not black bean sauce; rinsed and drained))', 'a small bunch of cilantro ((roughly chopped))', '1  scallion ((chopped))', 'noodles ((optional -- see note at the bottom of the post))",,4,5,Fish and Seafood,https://thewoksoflife.com/hunan-steamed-fish-salted-chilies-tofu-duo-jiao-yu/
A Duo of Dippables with Honey Sriracha Mayo,,,,"3/4 cup bread crumbs or panko', '1/2 cup fine cornmeal', '1 teaspoon salt', '1/2 teaspoon garlic powder', '1/4 teaspoon pepper', '1 teaspoon paprika', '1 tablespoon finely chopped scallion', '1/2 clove garlic ((minced))', '1 teaspoon honey', '1 teaspoon Sriracha', '3 tablespoons mayonnaise', '1 teaspoon lime juice', '1 package firm tofu', '2  chicken breasts', '1 tablespoon Sriracha', '3 tablespoons honey', '1/4 cup oil",,,,Appetizers,https://thewoksoflife.com/duo-dippables-honey-sriracha-mayo/
Loaded Crispy Tofu Tacos,PT30M,PT15M,PT45M,"1 pound firm tofu ((450g))', '1 tablespoon Sriracha', '1 tablespoon honey', '1/2 cup fine cornmeal', '1 teaspoon chili powder', '1 teaspoon cumin', '1/2 teaspoon salt', '1/2 teaspoon garlic powder', '1/8 teaspoon pepper', '1/4 cup oil', '3  scallions', '1 bunch cilantro', '1/4 cup yogurt', 'warm corn tortillas', 'shredded cheese', 'chopped tomato', 'chopped onion', 'sweet corn', 'avocado', 'lime wedges",,11,4.82,Tofu,https://thewoksoflife.com/loaded-crispy-tofu-tacos/
Fast Dubu Kimchi (Tofu w/ Stir-fried Kimchi & Pork),PT5M,PT20M,PT25M,"2/3 cup pork belly ((sliced))', '1  onion ((sliced))', '1  scallion ((sliced))', '2 1/2 cups kimchi', '1 1/2 cups rice cakes ((if frozen, rinse them in lukewarm water to defrost))', '2 tablespoons Gochujang ((Korean red pepper paste))', '1 pound soft tofu ((not “firm” and not “silken.” I know, tofu’s a mystical world of ambiguity).)",404 kcal,,,Main Course,https://thewoksoflife.com/fast-dubu-kimchi-tofu-w-stir-fried-kimchi-pork/
Spicy Cold Tofu (Liangban Dofu),PT5M,,PT5M,"1 tablespoon soy sauce', '1 tablespoon spicy bean paste', '1 teaspoon sesame oil', '½ teaspoon sugar', '2 cloves garlic ((minced))', '2 tablespoons scallion ((chopped))', '1 pound silken tofu', 'Optional: chopped thai basil, chopped cilantro, or chopped thousand year old egg",86 kcal,10,4.8,Tofu,https://thewoksoflife.com/spicy-cold-tofu-liangban-dofu/
Savory Soy Milk Soup w/ Fried Dough (Dou Jiang),PT5M,PT10M,PT15M,"Unsweetened soy milk', 'Chinese black vinegar', 'Salt', 'White pepper', 'Sesame oil', 'pickled mustard stems ((zha cai))', 'scallions ((chopped))', 'chinese fried crullers ((toasted and cut into slices))",,2,5,Soups and Stocks,https://thewoksoflife.com/soy-milk-soup-w-fried-dough-dou-jiang/
Hong Shao Kao Fu - Braised Wheat Gluten with Mushrooms,PT60M,PT60M,PT120M,"2 pieces dried wheat gluten/kao fu ((about 5” x 5” each: Soak in warm water until soft))', '12  dried shiitake mushrooms ((soaked in warm water until soft))', '1/2 cup dried wood ear mushrooms ((soaked in warm water until soft))', '1/2 cup dried lily-flower ((soaked in warm water until soft))', '3 tablespoons oil', '3 slices ginger', '¼ cup raw or roasted unsalted peanuts ((shelled and skins removed))', '3 tablespoons Shaoxing wine', '3 tablespoons light soy sauce', '1 tablespoon dark soy sauce', '3 teaspoons sugar', '3 cups water",,8,4.88,Tofu,https://thewoksoflife.com/hong-shao-kao-fu-braised-wheat-gluten-mushrooms/
Vegetable Five Spice Tofu Stir-Fry,PT20M,PT15M,PT35M,"1 cup five spice tofu ((julienned))', '1 cup celery ((julienned))', '1 cup king oyster mushrooms ((julienned))', '1 cup dried shiitake mushrooms ((reconstituted and julienned))', '1 cup carrot ((julienned))', '1 cup red bell pepper ((julienned))', '4 teaspoons oil', 'Pinch sugar', '1 tablespoon shaoxing wine', '1/2 teaspoon salt', 'Pinch five spice powder', 'Pinch white pepper', '2 teaspoons soy sauce",144 kcal,2,5,Tofu,https://thewoksoflife.com/vegetable-five-spice-tofu-stir-fry/
Scallion Ginger Beef and Tofu Stir Fry,PT15M,PT5M,PT20M,"8 oz. flank steak ((225g))', '1 teaspoon oil', '1 teaspoon cornstarch', '¼ teaspoon baking soda ((optional tenderizer))', '2 bunches scallions', '8 ounces firm tofu ((225g))', '1  small red bell pepper', '1 tablespoon shaoxing wine', '½ teaspoon hoisin sauce', '¼ teaspoon sesame oil', '1 teaspoon dark soy sauce', '1 tablespoon light soy sauce', '2 tablespoons oil', '7 slices ginger",451 kcal,2,5,Beef,https://thewoksoflife.com/scallion-ginger-beef-tofu/
Quick and Easy Braised Tofu (Hongshao Dofu),PT10M,PT10M,PT20M,"1 tablespoon cornstarch', '1 tablespoon water', '1 pound medium firm tofu ((450g))', '¼ cup fresh shiitake mushrooms ((or reconstituted dried mushrooms, sliced))', '1 ½ cups chicken stock ((or vegetable stock to make it vegetarian))', '1 tablespoon oyster sauce ((optional, or use a vegetarian oyster sauce made from mushrooms))', '½ teaspoon sesame oil', '1 tablespoon light soy sauce', '1 teaspoon dark soy sauce', '1 tablespoon shaoxing wine', '½ teaspoon sugar', '½ teaspoon salt', '1 tablespoon oil', '1 clove garlic ((minced))', '1 cup snow peas ((washed and trimmed))', '1  small carrot ((thinly sliced))', '1  small red bell pepper ((sliced))', '¼ cup bamboo shoots ((optional, sliced))",199 kcal,5,5,Tofu,https://thewoksoflife.com/quick-easy-braised-tofu-hongshao-dofu/
Hakka Style Chinese Stuffed Tofu,PT15M,PT15M,PT30M,"1 pound firm tofu ((450g))', '3 oz. ground pork ((85g))', '1 oz. salted fish ((optional, or substitute 4 small anchovy filets))', '1 teaspoon fresh ginger ((minced))', '2 teaspoons Shaoxing wine', '1/8 teaspoon white pepper', '1/4 teaspoon salt', '1  scallion', '1 tablespoon oyster sauce', '1 teaspoon dark soy sauce', '1 tablespoon cornstarch",375 kcal,5,4.8,Tofu,https://thewoksoflife.com/stuffed-tofu-hakka-style/
Jen's Tofu Stir-fry,PT20M,PT10M,PT30M,"1 teaspoon shaoxing wine', '1 teaspoon cornstarch', '½ teaspoon sesame oil', '½ teaspoon light soy sauce', '1/8 teaspoon ground white pepper', '½ cup lean pork ((thinly sliced))', '1 1/2 cups spiced tofu ((thinly sliced))', '1 1/2 cups long hot green peppers or bell peppers ((thinly sliced; use the long hot green pepper if you can take the heat))', '1 cup celery ((thinly sliced))', '4 tablespoons oil', 'Salt', '1 teaspoon sesame oil', '2 tablespoons Shaoxing wine', '1/8 teaspoon ground white pepper', '1 teaspoon soy sauce",318 kcal,3,5,Tofu,https://thewoksoflife.com/jens-tofu-stir-fry/
Chinese Spicy Eight Treasures Stir Fry,PT15M,PT30M,PT45M,"1 cup spiced bean curd ((cut in ½-inch cubes))', '1 cup carrot ((diced in ½-inch cubes))', '1 cup frozen shelled edamame ((thawed))', '1 cup lean pork ((diced into ½-inch cubes))', '2 heads garlic ((peeled and chopped))', '½ cup small dried shrimp ((rinsed and drained))', '1 cup raw shelled peanuts ((rinsed and drained))', '1 cup green pepper ((diced; long hot peppers can be used for extra heat, or you can use bell peppers if you prefer it mild))', '3 tablespoons cooking oil', '2 tablespoons shaoxing wine', '2 tablespoons spicy bean paste ((doubanjiang))', '1/2 teaspoon sugar', '1 tablespoon sesame oil', '1 teaspoon black bean chili sauce ((Lao Gan Ma brand))",384 kcal,2,5,"Fish and Seafood', 'Pork', 'Tofu",https://thewoksoflife.com/spicy-eight-treasures-stir-fry/
"Spicy Tofu ""Noodles"" with Chicken",PT5M,PT15M,PT20M,"1  small chicken breast ((sliced into thin strips))', '1 tsp sesame oil', '1 ½ teaspoons soy sauce', '2 tablespoons shaoxing wine', 'White pepper', 'Vegetable oil', '2 cloves garlic ((sliced))', '3  long hot green peppers ((seeds removed and sliced thinly))', '2  scallions ((cut into two-inch pieces))', '1  package tofu sheets ((cut into thin strips))",,,,Tofu,https://thewoksoflife.com/spicy-tofu-noodles-with-chicken/
Asian Turkey Lettuce Cups with Avocado,PT10M,PT25M,PT35M,"1 tablespoon oil', '3 cloves garlic ((minced))', '1 teaspoon ginger ((very finely minced))', '½ pound ground turkey ((225g))', '1 pound firm tofu ((450g))', '1  carrot ((diced))', '1 cup frozen corn', '1 cup edamame ((if you can’t find this, you can also substitute frozen peas))', '1  small onion ((diced))', '½ teaspoon sesame oil', '3 1/2 tablespoons soy sauce', '1 tablespoon dark soy sauce', '2 teaspoons Chinese black vinegar', '½ teaspoon red pepper flakes', 'Iceberg or romaine lettuce leaves', '1  avocado', '2 tablespoons chopped roasted unsalted peanuts', 'Sesame seeds ((for garnish))",,,,Chicken and Poultry,https://thewoksoflife.com/asian-turkey-lettuce-cups-with-avocado/
Pan-Fried Tofu with Soy Dipping Sauce,PT5M,PT15M,PT20M,"1 pound firm tofu ((450g))', '3 tablespoons vegetable oil', '1 tablespoon scallions ((chopped))', '1 tablespoon soy sauce', '2 cloves garlic ((chopped))', '½ teaspoon sesame oil', '1 teaspoon chili garlic sauce ((or chili black bean sauce, optional))",197 kcal,2,5,Tofu,https://thewoksoflife.com/pan-fried-tofu-with-soy-dipping-sauce/
Cold Tofu Salad,PT5M,PT5M,PT10M,"1 package tofu “noodles”', '1  carrot ((sliced into thin matchsticks))', '1  long hot green pepper ((sliced into long, thin strips))', '1 ½ teaspoons sesame oil', 'salt and white pepper', '1 teaspoon toasted sesame seeds",,,,Tofu,https://thewoksoflife.com/cold-tofu-salad/
Spicy Garlic Tofu Stir Fry,PT5M,PT10M,PT15M,"1 pound firm tofu ((450g, cut into 1” cubes))', '10 cloves garlic ((thinly sliced))', '3 oz. ground pork ((85g))', '2  large shallots ((finely chopped))', '3 tablespoons oil', '1 tablespoon hoisin sauce', '1 tablespoon spicy bean sauce ((doubanjiang))', '1/2 cup Shaoxing wine', '1/4 teaspoon ground white pepper', '1 teaspoon sugar', '2 teaspoons sesame oil', '1.5 cup chicken stock ((or vegetable stock))', '1 tablespoon cornstarch ((mixed into a slurry with 1 tablespoon water))', '1  scallion ((chopped))",363 kcal,2,4.5,Tofu,https://thewoksoflife.com/spicy-garlic-tofu/
Seaweed Egg Drop Soup (紫菜蛋花汤),PT5M,PT10M,PT15M,"5 g dried seaweed', '4 cups chicken stock ((or vegetable stock, 950 ml))', '1 cup water ((235 ml; can replace with more stock))', '5 g dried shrimp flakes ((optional))', '1/4-1/2 teaspoon sesame oil ((to taste))', '1/4 teaspoon white pepper', '2  eggs ((beaten))', '1  scallion ((thinly sliced))",77 kcal,1,5,Soup,https://thewoksoflife.com/seaweed-egg-drop-soup/
Chicken Noodle Wonton Soup,PT60M,,PT90M,"1 pound ground chicken', '1/2 cup parsley ((or to taste, finely chopped))', '1 clove garlic', '1/4 cup water', '2 tablespoons dry sherry cooking wine', 'juice of 1/2 a lemon', '1 tablespoon oil', '1 teaspoon salt', '1 teaspoon sugar', '1/2 teaspoon dried thyme ((or 1 1/2 teaspoons fresh))', '1/2 teaspoon black pepper', '2 tablespoons butter ((melted))', '1 package wonton wrappers', '1 tablespoon oil', '1/2  white onion ((diced))', '3  medium carrots ((about 1 cup, diced))', '3 stalks celery ((about 1 cup, diced))', '5 cups chicken broth', 'salt and pepper ((to taste))",400 kcal,1,5,Soup,https://thewoksoflife.com/chicken-noodle-wonton-soup/
How to Make a Clear Broth,,,,"meat, bones, and or vegetables', 'water",,1,5,Soups and Stocks,https://thewoksoflife.com/how-to-make-a-clear-broth/
Cantonese Chicken Feet Soup,PT60M,PT165M,PT225M,"15 grams dried seaweed ((haidai, 海带, also known as kelp or kombu - sliced into thin strips, a small handful))', '1 cup raw shelled peanuts ((150g))', '1 1/2 pounds chicken feet ((700g))', '2 tablespoons Shaoxing wine', '4 slices ginger', '12 cups water ((2800 ml))', 'salt ((to taste))', '1  scallion ((chopped))",294 kcal,6,4.84,Soups,https://thewoksoflife.com/cantonese-chicken-feet-soup/
Laksa,PT20M,PT50M,PT70M,"4  bone-in, skin-on chicken thighs', '4 tablespoons vegetable oil ((divided))', '1 clove garlic ((minced))', '1 1/2 tablespoons ginger ((minced))', '1 stalk lemongrass ((tough woody parts removed, minced))', '2  Thai chilies ((minced))', '1/2 cup laksa paste', '1 tablespoon brown sugar', '4 cups chicken stock', '1 can coconut milk ((13.5 ounces/400 ml))', '1 tablespoon fish sauce ((or to taste))', '1 package soy puffs ((halved))', '4 portions noodles ((Hokkien egg noodles, rice vermicelli, or fresh/dried wheat noodles))', '1-3  limes ((for juicing, and additional lime wedges for serving))', '3  large shallots ((thinly sliced))', '1/4 cup all purpose flour', '12  large shrimp', '2 cups mung bean sprouts ((trimmed and cleaned))', '1/2 cup fresh cilantro leaves",979 kcal,3,5,Noodle Soup,https://thewoksoflife.com/laksa/
Cantonese Pork Soup with Carrots & Chinese Yam,PT120M,PT210M,PT330M,"4  dried shiitake mushrooms ((large))', '600 grams lean pork shoulder/butt ((1 large piece, about 1 1/3 pounds))', '500 grams large carrots ((about 1 pound, cut into large chunks))', '15 grams dried red dates ((also known as dried jujubes, pitted and halved))', '15 grams dried goji berries', '1 large chunk ginger ((smashed))', '14 cups water', '500 grams Chinese yams ((about 1 pound, peeled and cut into large chunks))', 'salt ((to taste))",266 kcal,2,5,Soup,https://thewoksoflife.com/cantonese-pork-soup-carrot-chinese-yam/
